{"kind":"UserJourneyCurrent","layer":"Current","explorationArtifactRef":"docs/superpowers/specs/2026-06-07-project-todo-multi-agent-card-research.md","journey":{"persona":{"primaryRole":"Project operator / engineering lead","context":"Uses Web Terminal ACP to coordinate local and remote shell sessions, agent-clients, project todos, artifacts, review gates, and git worktrees for a software project."},"scenario":"Manage one agent-driven project todo across phased work, artifacts, review, and merge","trigger":"A product, bugfix, research, review, or operations request needs an AI agent to work inside the project with durable context and evidence.","desiredOutcome":"The user can keep one requirement card as the source of truth, run research/implementation/review/fix/test phases in isolated terminals, see artifact and review evidence roll up without slowing the board or terminal, then land or follow up safely.","asIs":{"phases":[{"phaseId":"capture_request","name":"Capture request","userGoal":"Preserve what needs to be done before starting agent work.","actions":["Write a natural-language todo or ask an agent directly in a terminal","Infer scope, constraints, and validation from surrounding docs"],"thoughts":["Is this enough context for an agent to execute without asking again?","Which parts are product decisions versus implementation details?"],"emotion":"uncertain","touchpoints":["Project todo panel","Terminal prompt","README and AGENTS.md"],"painPoints":["Acceptance criteria, constraints, artifact needs, and stop conditions are often implicit"],"branches":[{"type":"risk","label":"Ambiguous todo","condition":"The agent starts implementation before the user intent and validation target are clear."}],"evidenceRefs":["README.md#highlights","AGENTS.md#\u5de5\u4f5c\u539f\u5219","docs/superpowers/specs/2026-06-06-agent-development-optimization-research.md#\u63a8\u8350\u4ea7\u54c1\u80fd\u529b"]},{"phaseId":"prepare_context","name":"Prepare context","userGoal":"Give the agent the right project knowledge without flooding the prompt.","actions":["Search docs and code","Open related project todo, artifact, and previous agent record context"],"thoughts":["The next agent should not rediscover the same architecture boundaries.","I need the context pack to include the latest project rules."],"emotion":"cautious","touchpoints":["Project docs","Search","Agent record","Artifact drawer"],"painPoints":["Context is scattered across terminal history, docs, artifacts, and project todo metadata"],"branches":[{"type":"dropoff","label":"Context skipped","condition":"Small tasks bypass context preparation and later fail review because project rules were missed."}],"evidenceRefs":["docs/superpowers/specs/2026-06-06-agent-development-optimization-research.md#1-agent-\u5f00\u53d1\u7684\u6838\u5fc3\u8d44\u6e90\u662f\u4e0a\u4e0b\u6587\u4e0d\u662f\u6a21\u578b\u8c03\u7528\u6b21\u6570"]},{"phaseId":"dispatch_agent","name":"Dispatch agent","userGoal":"Start the right agent-client in the right runtime with safe isolation.","actions":["Choose a todo type, agent-client, profile, and requested artifact kinds","Launch or reuse a terminal window through the todo dispatch surface","Ensure managed shells use an agent worktree"],"thoughts":["This task needs Codex or a specialized profile?","Will this branch be tracked and merged back cleanly?"],"emotion":"focused","touchpoints":["Project todo dispatch modal","Agent profiles","Web Terminal managed shell","Git worktree status"],"painPoints":["Manual terminal setup can overwrite the single assigned terminal or leave work outside tracked worktrees","Research, implementation, review, fix, and test work are separate user intents, but the current card mainly exposes one assigned terminal pointer"],"branches":[{"type":"risk","label":"Wrong execution lane","condition":"A research or review task runs with an implementation-oriented prompt or missing artifact policy."},{"type":"workaround","label":"Phase hidden in history","condition":"The user opens detail history to reconstruct which terminal performed research, implementation, review, or fix work."}],"evidenceRefs":["AGENTS.md#Web Terminal Agent \u5f00\u53d1","docs/superpowers/specs/2026-06-07-project-todo-card-agent-artifact-research.md#\u9ed8\u8ba4\u6620\u5c04","docs/superpowers/specs/2026-06-07-project-todo-multi-agent-card-research.md#\u5f53\u524d\u7cfb\u7edf\u57fa\u7840"]},{"phaseId":"observe_work","name":"Observe work","userGoal":"Know whether the agent is progressing without interrupting the terminal.","actions":["Watch terminal output, board cards, artifact status, and agent status","Use card summaries, command history, artifacts, and worktree signals to assess state","Open todo details when multiple terminals or review runs are involved"],"thoughts":["Is the agent blocked, testing, reviewing, or just idle?","Terminal input and output must stay instant even when status panels update."],"emotion":"alert","touchpoints":["Terminal workspace","Project todo board","Project todo detail","Agent record","Window and project artifacts panels"],"painPoints":["Status, agent record, command history, artifact polling, and worktree refreshes can compete for attention and performance budget","Board polling that opportunistically creates requested artifacts can wait behind dispatch row locks and make todo list updates feel slow","A lightweight card summary does not yet explain active phase count, participant count, artifact readiness, and blocked child work together"],"branches":[{"type":"risk","label":"Terminal latency regression","condition":"Non-critical status projection slows the primary terminal input/output experience."},{"type":"risk","label":"Board lock contention","condition":"Artifact scheduling from the todo list waits on dispatch updates for the same project_todos rows."}],"evidenceRefs":["AGENTS.md#Web Terminal \u6027\u80fd\u4f18\u5148\u7ea7","docs/superpowers/specs/2026-06-07-project-todo-multi-agent-card-research.md#\u72b6\u6001\u805a\u5408","docs/performance-tuning/slow-sqls/2026-06-07-project-todo-artifact-lock-contention.md#Root Cause"]},{"phaseId":"review_evidence","name":"Review evidence","userGoal":"Decide from artifacts and validation evidence, not the agent's self-report.","actions":["Open generated terminal and project artifacts","Read changed files and work snapshot","Run or inspect validation results","Dispatch review when needed"],"thoughts":["Did the agent run the promised checks?","Are the artifacts useful for the next decision or only decorative?"],"emotion":"skeptical","touchpoints":["Project artifact viewer","Project todo artifacts panel","Review workflow","Git diff","Test output"],"painPoints":["Implementation completion, evidence presence, artifact readiness, and review approval are separate but not always visible as one gate","Project-level artifacts such as user_journey can become stale when todo and multi-agent workflows evolve"],"branches":[{"type":"branch","label":"Changes requested","condition":"Review finds a risk and the user sends the todo back for a fix phase."}],"evidenceRefs":["docs/superpowers/specs/2026-06-06-agent-development-optimization-research.md#4-agent-\u8d28\u91cf\u63d0\u5347\u4f9d\u8d56\u9a8c\u8bc1\u56de\u8def\u4e0d\u662f\u66f4\u957f-prompt","docs/superpowers/specs/2026-06-07-project-todo-card-agent-artifact-research.md#\u9ed8\u8ba4\u6620\u5c04"]},{"phaseId":"land_or_follow_up","name":"Land or follow up","userGoal":"Merge completed work and preserve reusable project knowledge.","actions":["Merge the agent branch back to main","Update project artifacts, summaries, and follow-up todos","Preserve which terminals, artifacts, review runs, and validation evidence supported completion","Clean up worktrees when appropriate"],"thoughts":["Is main now the source of truth?","What should future agents learn from this run?"],"emotion":"responsible","touchpoints":["Merge agent branch script","Project todo board","Documentation and artifact fixtures"],"painPoints":["Completed work can remain stranded on agent branches or in terminal history if the merge and knowledge handoff are not explicit","Without a phase timeline, future users may see a done card but not the route through research, implementation, review, and fixes"],"branches":[{"type":"risk","label":"Unlanded work","condition":"The todo looks complete, but main does not contain the agent branch or artifact update."}],"evidenceRefs":["AGENTS.md#Web Terminal Agent \u5f00\u53d1","docs/superpowers/specs/2026-06-07-project-todo-multi-agent-card-research.md#\u63a8\u8350\u6a21\u578b"]}]},"toBe":{"phases":[{"phaseId":"shape_task_contract","name":"Shape task contract","userGoal":"Turn the request into an executable todo with just enough decision structure.","actions":["Pick a todo type","Record goal, constraints, acceptance criteria, required artifact kinds, validation commands, and human checkpoints","Choose whether the work starts as a simple implementation dispatch or a phased work plan"],"thoughts":["The agent can execute from this card without guessing the product intent."],"emotion":"confident","touchpoints":["Project todo create/edit surface","Type defaults","Artifact kind selector"],"opportunities":["Use todo type defaults for agent/profile/artifact policy","Expose missing acceptance criteria before dispatch","Map product-design and user-review todos to page_review_cards plus project:user_journey maintenance"],"systemResponsibilities":["Keep the todo contract visible to implementation, review, and artifact generation agents"],"metrics":["todos_with_acceptance_criteria","dispatches_without_clarification_loop","project_artifact_requests_by_todo_type"],"evidenceRefs":["docs/superpowers/specs/2026-06-07-project-todo-card-agent-artifact-research.md#\u914d\u7f6e\u539f\u5219"]},{"phaseId":"assemble_context_pack","name":"Assemble context pack","userGoal":"Provide a compact source-of-truth context bundle before work starts.","actions":["Review generated references to AGENTS.md, relev